date,headline,summary,text,url,source
2025-07-22T17:03:13Z,"Download: iOS 26 Beta 4 OTA Profile Update, IPSW Links Out Now","Looking to download the latest iOS 26 beta 4 via OTA profile update or the IPSW links? Here’s how to install Apple’s latest developer beta on your iPhone.
The post Download: iOS 26 Beta 4 OTA Profile Update, IPSW Links Out Now first appeared on Redmond Pie.","Looking to download the latest iOS 26 beta 4 via OTA profile update or the IPSW links? Heres how to install Apples latest developer beta on your iPhone.
Apple has now released the fourth developer b… [+1516 chars]",https://www.redmondpie.com/download-ios-26-beta-4-ota-profile-update-ipsw-links-out-now/,redmondpie.com
2025-07-22T17:02:40Z,Apple Seeds Fourth Developer Betas of iOS 26 and iPadOS 26,"Apple today provided developers with the fourth betas of iOS 26 and iPadOS 26 for testing purposes, with the updates coming two weeks after Apple seeded the third betas.





Registered developers can download the new beta software using the Software Update s…","Apple today provided developers with the fourth betas of iOS 26 and iPadOS 26 for testing purposes, with the updates coming two weeks after Apple seeded the third betas.
Registered developers can do… [+1027 chars]",https://www.macrumors.com/2025/07/22/apple-seeds-ios-26-beta-4/,MacRumors
2025-07-22T17:02:33Z,Apple TV+ comedy ‘Loot’ to return for season three on October 15th,"Apple TV+ on Tuesday revealed that its comedy “Loot,” led by six-time Emmy Award-winning star and executive producer Maya Rudolph…
The post Apple TV+ comedy ‘Loot’ to return for season three on October 15th appeared first on MacDailyNews.","Maya Rudolph in Loot season three, premiering October 15 on Apple TV+.
Apple TV+ on Tuesday revealed that its comedy Loot, led by six-time Emmy Award-winning star and executive producer Maya Rudolph… [+3360 chars]",https://macdailynews.com/2025/07/22/apple-tv-comedy-loot-to-return-for-season-three-on-october-15th/,Macdailynews.com
2025-07-22T17:02:27Z,Apple releases iOS 26 beta 4 for iPhone,"Apple changed a few Liquid Glass elements in iOS 26 developer beta 3 and got a lot of online feedback. Now we’re on to iOS 26 beta 4, which will surely be compared under the microscope in as much detail in this season of change.



 more…","Apple changed a few Liquid Glass elements in iOS 26 developer beta 3 and got a lot of online feedback. Now we’re on to iOS 26 beta 4, which will surely be compared under the microscope in as much det… [+2152 chars]",https://9to5mac.com/2025/07/22/ios-26-beta-4/,9to5Mac
2025-07-22T17:02:22Z,iPadOS 26 beta 4 now available with latest iPad changes,"Apple has just released iPadOS 26 beta 4 to developers. Today’s release will likely also be the build that gets shipped as the public beta soon. Here’s what to expect.



 more…","Apple has just released iPadOS 26 beta 4 to developers. Todays release will likely also be the build that gets shipped as the public beta soon. Heres what to expect.
Just over two weeks ago, Apple s… [+1054 chars]",https://9to5mac.com/2025/07/22/ipados-26-beta-4-now-available-with-latest-ipad-changes/,9to5Mac
2025-07-22T17:02:19Z,iOS 26 Beta 4 Now Available With 9 New Features,iOS 26 beta 4 is now available and brings a number of new features to the iPhone as Apple continues to tweak the look and feel of Liquid Glass.,"A couple of weeks after releasing iOS 26 beta 3, Apple is now making beta 4 available to developers. This new build should continue to improve the general experience, stability, and battery drain pre… [+1417 chars]",https://www.bgr.com/1919057/ios-26-beta-4-new-features-download-now-available/,BGR
2025-07-22T17:01:00Z,"Apple Seeds Fourth watchOS 26, tvOS 26, and visionOS 26 Developer Betas","Apple today provided developers with the fourth betas of watchOS 26, tvOS 26, and visionOS 26 for testing purposes, with the betas coming two weeks after the third betas were released.





The software updates can be downloaded through the Settings app on ea…","Apple today provided developers with the fourth betas of watchOS 26, tvOS 26, and visionOS 26 for testing purposes, with the betas coming two weeks after the third betas were released.
The software … [+858 chars]",https://www.macrumors.com/2025/07/22/apple-seeds-watchos-26-beta-4/,MacRumors
2025-07-22T17:00:00Z,$16.5B Apple tax windfall will pay for new electricity and water infrastructure in Ireland,"With the last remaining part of the Apple tax windfall paid to the Irish government recently, we are today learning what the country plans to do with the €14.25B ($16.5B).



The country’s prime minister has promised “unprecedented” investment in the country’…","With the last remaining part of the Apple tax windfall paid to the Irish government recently, we are today learning what the country plans to do with the 14.25B ($16.5B).
The country’s prime ministe… [+2042 chars]",https://9to5mac.com/2025/07/22/16-5b-apple-tax-windfall-will-pay-for-new-electricity-and-water-infrastructure-in-ireland/,9to5Mac
2025-07-22T17:00:00Z,How to watch Colombia vs Bolivia in the USA: Live Stream and TV for CONMEBOL Women’s Copa America 2025,"Colombia face Bolivia in Matchday 4 of the CONMEBOL Women’s Copa America 2025 group stage. Fans in the U.S. can catch all the action live through full TV coverage and streaming platforms.
 Colombia return to action in Matchday 4 riding high from a 4-1 result …","Colombiareturn to action in Matchday 4 riding high from a 4-1 result over Paraguay, now sitting on four points with plenty on the line. With a decisive matchup against Braziljust ahead, the team is l… [+2086 chars]",https://worldsoccertalk.com/watch-on-us-tv/how-to-watch-colombia-vs-bolivia-in-the-usa-live-stream-and-tv-for-conmebol-womens-copa-america-2025/,Worldsoccertalk.com
2025-07-22T16:58:08Z,These die-hard New Yorkers dedicate their lives to showing tourists the best of the Big Apple — and they have no plans to stop,All aboard!,"All aboard! 
These die-hard New Yorkers have spent decades doing what most would find unthinkable showing tourists the sights of the Big Apple.
This year, Circle Line Cruises celebrates 80 years of… [+12075 chars]",https://nypost.com/2025/07/22/lifestyle/these-die-hard-new-yorkers-dedicate-their-lives-to-showing-tourists-the-best-of-the-big-apple-and-they-have-no-plans-to-stop/,New York Post
2025-07-22T16:56:00Z,Apple's iOS 26 and iPadOS 26 public betas are releasing any minute now: What to expect,"Wondering when you can try Apple's public betas for the iPhone, iPad, Apple Watch, and more? All the details - release date, eligibility, and how to get them - are here.","Elyse Betters Picaro / ZDNET
Apple held its Worldwide Developers Conference a month ago, during which it previewed the latest operating system upgrades across all of its devices, including iOS, iPad… [+4423 chars]",https://www.zdnet.com/article/apples-ios-26-and-ipados-26-public-betas-are-releasing-any-minute-now-what-to-expect/,ZDNet
2025-07-22T16:55:59Z,Steve Jobs’ daughter’s £5 million wedding set to dazzle with Elton John and VIP guest list,"Eve Jobs, daughter of Steve Jobs, is set to marry Harry Charles in a lavish, four-day Oxfordshire wedding. The celebration, estimated at £5 million, includes high-profile guests like Kamala Harris and a performance by Elton John. The event blends English eleg…","Eve Jobs, Apple co-founder Steve Jobs' youngest daughter, will marry British showjumper Harry Charles this weekend. Expect a lavish weekend-long celebration that includes top-tier security, private j… [+4813 chars]",https://economictimes.indiatimes.com/news/international/us/steve-jobs-daughters-5-million-wedding-set-to-dazzle-with-elton-john-and-vip-guest-list/articleshow/122841893.cms,The Times of India
2025-07-22T16:54:56Z,A slice of the apple,,Copyright © 2025 WorldNetDaily,https://www.wnd.com/2025/07/slice-apple/,Wnd.com
2025-07-22T16:52:54Z,‘Women Here Are Going to Have Access to Abortion’: How Gov. Maura Healey Made Massachusetts into a Beacon for Reproductive Freedom,"In the second episode of Looking Back, Moving Forward—a Ms. podcast exploring the history of the magazine and the feminist movement—Gov. Maura Healey talked about how Massachusetts prepared for the Trump administration’s attacks on abortion, what other states…","Gov. Maura Healey (D-Mass.) speaks at a Harris-Walz Fighting for Reproductive Freedom press conference at the Pennsylvania State Capitol in Harrisburg, Pa., on Sept. 18, 2024. (Nathan Morris / NurPho… [+13851 chars]",https://msmagazine.com/2025/07/22/women-abortion-massachusetts-governor-maura-healey/,Ms. Magazine
2025-07-22T16:51:47Z,EU antitrust regulators will reportedly approve Apple’s App Store changes,Apple may avoid punitive daily fines for breaching the European Union's (EU) Digital Markets Act as the bloc is set to approve the App Store changes.,"Apple may avoid punitive daily fines for breaching the European Union’s (EU) Digital Markets Act as the bloc is set to approve the App Store changes.
Reuters learned today that the European Commissi… [+2473 chars]",https://www.idownloadblog.com/2025/07/22/eu-antitrust-regulators-will-reportedly-approve-apples-app-store-changes/,Idownloadblog.com
2025-07-22T16:49:00Z,What CFOs Need To Know (And Often Don’t) About Company Workers,"Also in the Forbes CFO newsletter: CFOs are prepared, but concerned; markets defy tariff concerns and set records; Trump signs stablecoin regulations.","There arent many good things to have come out of the Covid-19 pandemic, but a new study of finance professionals from accounts payable software maker AvidXchange pinpoints one of them: Businesses inc… [+15820 chars]",https://www.forbes.com/sites/cfo/2025/07/22/what-cfos-need-to-know-and-often-dont-about-company-workers/,Forbes
2025-07-22T16:48:11Z,"Nvidia, Apple Partner Sets Up After 217% Surge; Custom Chip King Eyes AI Boom",is near a handle buy point of 168.31 in a very deep cup base. Shares have tripled since they started trading on the Nasdaq in September 2023 at an initial offering price of $51. Arm stock is Tuesday's selection for IBD 50 Stocks To Watch. Earnings growth acce…,is near a handle buy point of 168.31 in a very deep cup base. Shares have tripled since they started trading on the Nasdaq in September 2023 at an initial offering price of $51. Arm stock is Tuesday'… [+149 chars],https://biztoc.com/x/6d8227d9efa563d2,Biztoc.com
2025-07-22T16:48:03Z,"‘Fantastic Four: First Steps’ review: Ugh, here we go again","“Fantastic Four”? Forgettable, 1 ½.","movie reviewRunning time: 115 minutes. Rated PG-13 (action/violence and some language). In theaters July 25.
Calling Fantastic Four: First Steps the best Fantastic Four movie so far is not exactly a… [+4321 chars]",https://nypost.com/2025/07/22/entertainment/fantastic-four-first-steps-review-ugh-here-we-go-again/,New York Post
2025-07-22T16:47:25Z,"Apple's Latest App Store Changes Satisfy EU, No More Fines Coming","The European Union is set to accept the June updates that Apple made to its App Store to comply with the Digital Markets Act, reports Reuters. As a result, Apple will not face daily fines for non-compliance.





Apple changed its ‌App Store‌ fee setup and re…","The European Union is set to accept the June updates that Apple made to its App Store to comply with the Digital Markets Act, reports Reuters. As a result, Apple will not face daily fines for non-com… [+2474 chars]",https://www.macrumors.com/2025/07/22/app-store-eu-changes-accepted/,MacRumors
2025-07-22T16:42:34Z,App Store changes should avoid further EU fines,"A new report says that the European Union is now likely to approve the App Store changes that Apple has made, and so not impose the threatened daily fines for noncompliance.Brussels officials reportedly say the EU will accept App Store changes — image credit:…","A new report says that the European Union is now likely to approve the App Store changes that Apple has made, and so not impose the threatened daily fines for noncompliance.
Apple has recently been … [+2430 chars]",https://appleinsider.com/articles/25/07/22/app-store-changes-should-avoid-further-eu-fines,AppleInsider
2025-07-22T16:42:32Z,UGREEN debuts new 3-in-1 Qi2-certified MagSafe wireless travel charger with fold out Apple Watch puck [Launch deal],"UGREEN already has some of the most affordable and unique wireless chargers on the market, and it just added another one to its lineup. After announcing the world’s first Qi2.2-certified 25W power bank, the brand just unleashed a new 3-in-1 Qi2-certified MagS…","UGREEN already has some of the most affordable and unique wireless chargers on the market, and it just added another one to its lineup. After announcing the worlds first Qi2.2-certified 25W power ban… [+2497 chars]",http://9to5toys.com/2025/07/22/ugreen-3-in-1-qi2-certified-magsafe-wireless-travel-charger/,9to5Toys
2025-07-22T16:39:33Z,NYC Mayor Says He Will ‘Welcome’ Help Arresting ‘Dangerous’ Criminal Illegal Aliens,"New York City Mayor Eric Adams says he will “welcome” the help of border czar Tom Homan to arrest criminal illegal aliens like the ones... Read More
The post NYC Mayor Says He Will ‘Welcome’ Help Arresting ‘Dangerous’ Criminal Illegal Aliens   appeared first …",New York City Mayor Eric Adams says he will welcome the help of border czar Tom Homan to arrest criminal illegal aliens like the ones who attacked a Customs and Border Protection officer in the city … [+4140 chars],https://www.dailysignal.com/2025/07/22/nyc-mayor-says-he-will-welcome-help-arresting-dangerous-criminal-illegal-aliens/,Daily Signal
2025-07-22T16:39:24Z,"Apple set to stave off daily fines, EU to accept App Store changes, sources say","The company last month said developers will pay a 20% processing fee for purchases made via the App Store, though the fees could go as low as 13% for Apple's small-business program.","Apple's changes to its App Store rules and fees will likely secure the green light from EU antitrust regulators, people with direct knowledge of the matter said, a move that would stave off potential… [+1271 chars]",https://economictimes.indiatimes.com/tech/technology/apple-set-to-stave-off-daily-fines-eu-to-accept-app-store-changes-sources-say/articleshow/122841861.cms,The Times of India
2025-07-22T16:37:43Z,Roku 65-Inch Pro Series Mini-LED TV (2025),"Roku's 2025 Pro Series TV gets a bit brighter than its predecessor while still offering wide colors and a very accessible, media-focused viewing experience for a reasonable price.
Roku’s 2025 Pro Series is the company’s newest top-of-the-line mini-LED TV, off…","Rokus 2025 Pro Series is the companys newest top-of-the-line mini-LED TV, offering a bright and colorful picture, responsive gaming performance, hands-free voice control, Apple AirPlay support, and e… [+7993 chars]",https://me.pcmag.com/en/tvs/31084/roku-65-inch-pro-series-mini-led-tv-2025,PCMag.com
2025-07-22T16:37:43Z,Roku 65-Inch Pro Series Mini-LED TV (2025),"Roku's 2025 Pro Series TV gets a bit brighter than its predecessor while still offering wide colors and a very accessible, media-focused viewing experience for a reasonable price.
Roku’s 2025 Pro Series is the company’s newest top-of-the-line mini-LED TV, off…","Rokus 2025 Pro Series is the companys newest top-of-the-line mini-LED TV, offering a bright and colorful picture, responsive gaming performance, hands-free voice control, Apple AirPlay support, and e… [+7993 chars]",https://uk.pcmag.com/tvs/159244/roku-65-inch-pro-series-mini-led-tv-2025,PCMag.com
2025-07-22T16:37:26Z,"Analysts Stay Positive Ahead of Earnings, But AI Clarity Still Needed","In This Article:
Apple Inc. (NASDAQ:AAPL) is one of the AI Stocks Analysts Are Tracking Closely. On July 21, Morgan Stanley reiterated the stock as “Overweight,” noting that it’s sticking with Apple shares ahead of a solid quarter.
The firm believes that stro…","In This Article:Apple Inc. (NASDAQ:AAPL) is one of the AI Stocks Analysts Are Tracking Closely. On July 21, Morgan Stanley reiterated the stock as Overweight, noting that its sticking with Apple shar… [+145 chars]",https://biztoc.com/x/8b8cd4f4d8d47f52,Biztoc.com
2025-07-22T16:37:09Z,Pepsi reveals new drink after buying soda brand Poppi for $2 billion,Pepsi Co said it was launching the product to adapt to ‘changing consumer preferences’,"Your support helps us to tell the story
From reproductive rights to climate change to Big Tech, The Independent is on the ground when the story is developing. Whether it's investigating the financia… [+3015 chars]",https://www.the-independent.com/life-style/food-and-drink/news/pepsi-reveals-new-drink-poppi-b2793867.html,The-independent.com
2025-07-22T16:36:04Z,‘Mission: Impossible – The Final Reckoning’ Gets Streaming Date,Tom Cruise’s “Mission: Impossible – The Final Reckoning’ is coming soon to digital streaming. Find out when you can watch the movie at home.,"Tom Cruise and Esai Morales in ""Mission: More
 Impossible - The Final Reckoning.""Less
Paramount Pictures
Tom Cruises action blockbuster Mission: Impossible The Final Reckoning is coming soon to di… [+4286 chars]",https://www.forbes.com/sites/timlammers/2025/07/22/mission-impossible--the-final-reckoning-gets-streaming-date/,Forbes
2025-07-22T16:32:55Z,'Pokemon' joins the daily puzzle craze with new iPhone game,"A new free iPhone game called ""Pokemon Friends"" brings yet another daily puzzle game to iPhone with plush collecting charm.New Pokemon gameAvailable now on the App Store, Pokemon Friends joins the growing wave of daily puzzle games that encourage regular play…","A new free iPhone game called ""Pokemon Friends"" brings yet another daily puzzle game to iPhone with plush collecting charm.
Available now on the App Store, Pokemon Friends joins the growing wave of … [+1626 chars]",https://appleinsider.com/articles/25/07/22/pokemon-joins-the-daily-puzzle-craze-with-new-iphone-game,AppleInsider
2025-07-22T16:31:21Z,Poppi Founder Allison Ellsworth on Selling Her $500 Million Brand: 'You're Happy But You Have Anxiety',"""You’re happy but you have anxiety,"" said Allison Ellsworth, reflecting with Fortune on PepsiCo's $1.95 billion acquisition of the neon-canned prebiotic soda...","""Youre happy but you have anxiety,"" said Allison Ellsworth, reflecting with Fortune on PepsiCo's $1.95 billion acquisition of the neon-canned prebiotic soda she once brewed at home. The comment summe… [+3490 chars]",https://finance.yahoo.com/news/poppi-founder-allison-ellsworth-selling-163121802.html,Yahoo Entertainment
2025-07-22T16:30:17Z,How to get clear app icons on your iPhone or iPad Home Screen,"Learn how to use clear, transparent app icons in iOS 26 that complement the Liquid Glass design and add a unique look to your iPhone Home Screen.","Learn how to turn on Apple’s new Clear style on the Home Screen for transparent app icons, complementing the Liquid Glass design overhaul in iOS 26.
With last years iOS 18 update, Apple brought Dark… [+3068 chars]",https://www.idownloadblog.com/2025/07/22/how-to-use-clear-app-icons-iphone/,Idownloadblog.com
2025-07-22T16:30:00Z,"Galaxy Watch Ultra Gets Wear OS 6 and One UI 8: Health, Smarts, and Style",Samsung's Galaxy Watch Ultra receives Wear OS 6 and One UI 8 Watch globally this week. The flagship adventure wearable gains enhanced health monitoring,"Samsung's Galaxy Watch Ultra receives Wear OS 6 and One UI 8 Watch globally this week. The flagship adventure wearable gains enhanced health monitoring capabilities, smarter interface features, and e… [+3501 chars]",https://www.talkandroid.com/512419-samsung-galaxy-watch-ultra-one-ui-8/,TalkAndroid
2025-07-22T16:30:00Z,DeWanda Wise Signs With Range Media Partners,"EXCLUSIVE: Range Media Partners has signed actor and filmmaker DeWanda Wise for representation. Breaking out with her starring role in Netflix’s series adaptation of Spike Lee’s She’s Gotta Have It, Wise has most recently been seen opposite Alexander Skarsgår…","EXCLUSIVE: Range Media Partners has signed actor and filmmaker DeWanda Wise for representation.
Breaking out with her starring role in Netflix’s series adaptation of Spike Lee’s She’s Gotta Have It,… [+1667 chars]",http://deadline.com/2025/07/dewanda-wise-signs-range-media-partners-1236463862/,Deadline
2025-07-22T16:27:06Z,It Appears that Apple may be able to stave off daily fines as EU antitrust regulators are expected to accept Apple’s App Store changes,It’s being reported this morning in an exclusive report from Reuters that the changes that Apple made to its App Store rules and fees will likely secure the green light from EU antitrust regulators,"Its being reported this morning in an exclusive report from Reuters that the changes that Apple made to its App Store rules and fees will likely secure the green light from EU antitrust regulators, p… [+1229 chars]",https://www.patentlyapple.com/2025/07/it-appears-that-apple-may-be-able-to-stave-off-daily-fines-as-eu-antitrust-regulators-are-expected-to-accept-apples-app-st.html,Patently Apple
2025-07-22T16:26:50Z,Apple Alerted Dozens of Iranians Targeted by Sophisticated Spyware Attacks,"Apple has quietly been sending threat notifications to users it believes are being targeted by advanced cyberattacks. In the first half of 2025, more than a dozen Iranians received these alerts, including government officials, tech workers, and dissidents, ac…","Apple has quietly been sending threat notifications to users it believes are being targeted by advanced cyberattacks. In the first half of 2025, more than a dozen Iranians received these alerts, incl… [+2013 chars]",https://www.macobserver.com/news/apple-alerted-dozens-of-iranians-targeted-by-sophisticated-spyware-attacks/,The Mac Observer
2025-07-22T16:22:00Z,Huawei Pura 80 slated for imminent launch with new version of last-gen silicon,"Even Huawei seems to concede that its next new smartphone will be a much less aspirational version of the Pura 80 Ultra in its new teasers. The vanilla 80 is backed to launch with the latest version of the OEM's HarmonyOS and an on-trend flat display, but lac…","Huawei introduced successors to the Pura 70 Ultra and Pro+ in the absence of those for their 70 Pro and 70 siblings earlier in 2025. The latter will be introduced seemingly all by itself very soon, t… [+1370 chars]",https://www.notebookcheck.net/Huawei-Pura-80-slated-for-imminent-launch-with-new-version-of-last-gen-silicon.1064980.0.html,Notebookcheck.net
2025-07-22T16:21:47Z,M5 iPad Pro Rumor Hints at Dual Front Cameras: Here's What They Might Be For,"Apple is reportedly planning to add another front-facing camera to the iPad Pro for better portrait mode results. But would Apple really add extra hardware just for that?
The M5 iPad Pro is expected later this year, and it might come with two front-facing cam…","The M5 iPad Pro is expected later this year, and it might come with two front-facing cameras.
As Bloomberg's Mark Gurman reports, the iPad Pro underwent a major design change last year, when Apple m… [+1631 chars]",https://uk.pcmag.com/tablets/159243/m5-ipad-pro-rumor-hints-at-dual-front-cameras-heres-what-they-might-be-for,PCMag.com
2025-07-22T16:21:47Z,M5 iPad Pro Rumor Hints at Dual Front Cameras: Here's What They Might Be For,"Apple is reportedly planning to add another front-facing camera to the iPad Pro for better portrait mode results. But would Apple really add extra hardware just for that?
The M5 iPad Pro is expected later this year, and it might come with two front-facing cam…","The M5 iPad Pro is expected later this year, and it might come with two front-facing cameras.
As Bloomberg's Mark Gurman reports, the iPad Pro underwent a major design change last year, when Apple m… [+1631 chars]",https://me.pcmag.com/en/tablets/31083/m5-ipad-pro-rumor-hints-at-dual-front-cameras-heres-what-they-might-be-for,PCMag.com
2025-07-22T16:19:02Z,This under-desk treadmill is a “gamechanger” — pick it up for over $150 off,Run - don't walk – to pick up this great treadmill deal on Amazon!,"New York Post may be compensated and/or receive an affiliate commission if you click or buy through our links. Featured pricing is subject to change.
Remember the 90s?
We do! Way back then, they pu… [+1905 chars]",https://nypost.com/2025/07/22/shopping/trailviber-walking-pad-treadmill-deal-amazon/,New York Post
2025-07-22T16:14:50Z,"Apple (AAPL) Analysts Stay Positive Ahead of Earnings, But AI Clarity Still Needed",,"If you click 'Accept all', we and our partners, including 236 who are part of the IAB Transparency &amp; Consent Framework, will also store and/or access information on a device (in other words, use … [+714 chars]",https://consent.yahoo.com/v2/collectConsent?sessionId=1_cc-session_88ab5ecf-1f31-4253-bb21-120e3538c311,Yahoo Entertainment
2025-07-22T16:14:39Z,"OpenAI faces an ‘increasingly fragile moat,’ JPMorgan says, as Sam Altman braces for ‘OS war’ against Google, Apple and other Silicon Valley titans","OpenAI is the world’s third-most-valuable private company—valued at $300 billion in its latest fundraise in March 2025, and it’s “marching to the beat of its own disruption drum,” according to JPMorgan. At the same time, the bank warns, the risks to the compa…","OpenAI is the worlds third-most-valuable private companyvalued at $300 billion in its latest fundraise in March 2025, and its marching to the beat of its own disruption drum, according to JPMorgan. A… [+134 chars]",https://biztoc.com/x/40880a5bca570a29,Biztoc.com
