date,headline,summary,text,url,source
2025-07-22T16:13:00Z,"Jackbox Reveals ""Hear Say,"" A Party Pack 11 Game Where Your Voice Is the Star",Speaking out,"Get ready to make some noise. Jackbox Games has just unveiled the fourth game in The Jackbox Party Pack 11: Hear Say! Watch the reveal trailer here.
In Hear Say, your voice takes center stage. Playe… [+1511 chars]",https://gonintendo.com/contents/50984-jackbox-reveals-hear-say-a-party-pack-11-game-where-your-voice-is-the-star,GoNintendo
2025-07-22T16:12:38Z,I’ve Tested Dozens of Budget Headphones—Here’s What You Should Never Compromise On,Saving money and a good listening experience aren't mutually exclusive.,"Good tech doesn't need to cost a lot of money, and in particular, you can get plenty of amazing headphones without burning a hole in your pocket. But while some aspects aren't deal-breakers, you shou… [+5183 chars]",https://www.makeuseof.com/budget-headphone-buying-tips/,MakeUseOf
2025-07-22T16:12:00Z,The Computer History Museum’s Vintage Computer Festival: August 1–2,"Come and explore an extraordinary showcase of historical computers, from pristine originals to ingenious modern hacks. Computer enthusiasts around the world look forward to the annual Vintage Computer Festival. Experience hands-on demos of historical systems …","Come and explore an extraordinary showcase of historical computers, from pristine originals to ingenious modern hacks. Computer enthusiasts around the world look forward to the annual Vintage Compute… [+899 chars]",https://computerhistory.org/events/vintage-computer-festival-3/,Computerhistory.org
2025-07-22T16:05:00Z,Adi Azran Joins the Urban Pitch Podcast,"One of the funniest soccer creators in the game, Adi Azran sits down with the Urban Pitch Podcast crew to discuss his complicated relationship with soccer, the difficulties of going pro, and his favor...","One of the funniest soccer creators in the game, Adi Azran sits down with the Urban Pitch Podcast crew to discuss his complicated relationship with soccer, the difficulties of going pro, and his favo… [+624 chars]",https://urbanpitch.com/adi-azran-joins-the-urban-pitch-podcast/,Urbanpitch.com
2025-07-22T16:05:00Z,"The Fantastic Four: First Steps review: Marvel has been bland before, but rarely this lethargic","Different Earth, same old problems. Kevin Feige, the excitable head of cinema’s noisiest blockbuster ­factory, has declared The ­Fantastic Four: First Steps a “no-homework-required movie”.","Different Earth, same old problems. Kevin Feige, the excitable head of cinemas noisiest blockbuster ­factory, has declared The ­Fantastic Four: First Steps a no-homework-required movie. Hardly the ca… [+4074 chars]",https://www.independent.ie/entertainment/movies/movie-reviews/the-fantastic-four-first-steps-review-marvel-has-been-bland-before-but-rarely-this-lethargic/a1334563962.html,Independent.ie
2025-07-22T16:04:16Z,"Apple TV+ has Released the Trailer for Season Three of the Comedy ‘Loot,’ Celebrated the Premiere of ‘Chief of War’ & more","Today, Apple TV+ revealed that its celebrated comedy “Loot,” led by six-time Emmy Award-winning star and executive producer Maya Rudolph, is officially set to return this fall.","Today, Apple TV+ revealed that its celebrated comedy Loot, led by six-time Emmy Award-winning star and executive producer Maya Rudolph, is officially set to return this fall. The 10-episode third sea… [+1905 chars]",https://www.patentlyapple.com/2025/07/apple-tv-has-released-the-trailer-for-season-three-of-the-comedy-loot-celebrated-the-premiere-of-chief-of-war.html,Patently Apple
2025-07-22T16:03:34Z,Samsung Brings One UI 8 Watch to Galaxy Watch Ultra,"Today, Samsung announced the availability of One UI 8 Watch for the one wearable it's not updating internally, the Galaxy Watch Ultra.
The post Samsung Brings One UI 8 Watch to Galaxy Watch Ultra appeared first on Thurrott.com.","Samsung is launching its new Galaxy Watch 8 lineup with One UI 8 Watch alongside the Galaxy Z Fold7 and Z Flip7 foldables. Today, Samsung announced the availability of One UI 8 Watch for the one wear… [+1821 chars]",https://www.thurrott.com/wearables/323653/samsung-brings-one-ui-8-watch-to-galaxy-watch-ultra,Thurrott.com
2025-07-22T16:03:17Z,Apple working on edge-lit notification system for Apple Ring & more,"New research from Apple shows that it is looking at how to make an Apple Ring display a notification — and then how that same system can be used across practically every device.It could be Ringworld, but it looks more like a ring — image credit: ApplePractica…","New research from Apple shows that it is looking at how to make an Apple Ring display a notification — and then how that same system can be used across practically every device.
Practically all of t… [+4426 chars]",https://appleinsider.com/articles/25/07/22/apple-working-on-edge-lit-notification-system-for-apple-ring-more,AppleInsider
2025-07-22T16:02:48Z,Exclusive: Official Google Pixel 10 Pro XL Renders,"The Google Pixel 10 series launch is just around the corner, and today we're able to share with you the official renders of the Pixel 10 Pro XL. We've","The Google Pixel 10 series launch is just around the corner, and today were able to share with you the official renders of the Pixel 10 Pro XL. Weve already shared the renders for the Pixel 10 and Pi… [+1441 chars]",https://www.androidheadlines.com/google-pixel-10-pro-xl-official-renders,Android Headlines
2025-07-22T16:00:49Z,Walmart Ad Deals: 7/21-7/27,"Here is a list of the deals from the current Walmart ad! Get good deals on Aveeno products, Tylenol, Happy Baby formula, Pampers diapers, and more. For Walmart cash deals, you’ll be able to use your earnings on your very next Walmart purchase. You can earn th…","Here is a list of the deals from the current Walmart ad! Get good deals on Aveeno products, Tylenol, Happy Baby formula, Pampers diapers, and more.
For Walmart cash deals, youll be able to use your … [+20985 chars]",https://www.southernsavers.com/walmart-ad-deals-721-727-2/,Southernsavers.com
2025-07-22T16:00:41Z,"OpenAI faces an ‘increasingly fragile moat,’ JPMorgan says, as Sam Altman braces for ‘OS war’ against Google, Apple and other Silicon Valley titans","OpenAI has a $700 billion-plus total addressable market ahead of it, JPMorgan says as it takes the rare step of covering a private company.","OpenAI is the worlds third-most-valuable private companyvalued at $300 billion in its latest fundraise in March 2025, and its marching to the beat of its own disruption drum, according to JPMorgan. A… [+8977 chars]",https://fortune.com/2025/07/22/openai-os-war-microsoft-google-apple-platforms-jpmorgan-coverage/,Fortune
2025-07-22T16:00:41Z,"OpenAI faces an ‘increasingly fragile moat,’ JPMorgan says, as Sam Altman braces for ‘OS war’ against Google, Apple and other Silicon Valley titans","OpenAI has a $700 billion-plus total addressable market ahead of it, JPMorgan says as it takes the rare step of covering a private company.","OpenAI is the worlds third-most-valuable private companyvalued at $300 billion in its latest fundraise in March 2025, and its marching to the beat of its own disruption drum, according to JPMorgan. A… [+9057 chars]",https://finance.yahoo.com/news/openai-faces-increasingly-fragile-moat-160041084.html,Yahoo Entertainment
2025-07-22T16:00:22Z,"‘The Fantastic Four: First Steps’ Isn’t Quite Fantastic, But It’s Pretty Great","Pedro Pascal, Vanessa Kirby, Ebon Moss-Bachrach, and Joseph Quinn star in Marvel's latest, out July 25.","The Fantastic Four: First Steps is like an ice-cold drink on a warm summer’s day. A slice of apple pie with a glass of milk. It’s a nice, simple, familiar-feeling movie that will make you feel warm a… [+5874 chars]",https://gizmodo.com/fantastic-four-first-steps-review-marvel-2000632408,Gizmodo.com
2025-07-22T16:00:20Z,Faster wireless charging: Baseus’s new Qi2.2 Chargers boost speed to 25W,This article is sponsored by Baseus.,"This article is sponsored by Baseus. Product choices and opinions expressed are from the sponsor and do not reflect the views of XDA editorial staff.
While several brands have quietly secured Qi2.2 … [+6275 chars]",https://www.xda-developers.com/faster-wireless-charging-baseus-qi22-charger/,XDA Developers
2025-07-22T16:00:00Z,‘The Buccaneers’ Exclusive Clip: Is It “Unforgivable” That Theo Still Misses Lizzie?!,Get a sneak peek at where things stand between the Duke of Tintagel and his new love in this week's episode of The Buccaneers.,"Perhaps the juiciest storyline to emerge from The Buccaneers Season 2 is the wild romance that’s developed between Theo, Duke of Tintagel (Guy Remmers), and Lizzie Elmsworth (Aubri Ibrag). Theo spent… [+1798 chars]",https://decider.com/2025/07/22/the-buccaneers-season-2-episode-6-exclusive-clip-theo-lizzie/,Decider
2025-07-22T16:00:00Z,I just tested the first cheap AirPods rival that I didn’t prefer to Apple’s earbuds,"The Denon AH-C500W come at a surprising price, undercutting Apple’s AirPods – but not by enough to make them must-buy rivals","Why you can trust TechRadar
We spend hours testing every product or service we review, so you can be sure you’re buying the best. Find out more about how we test.Denon AH-C500W: Two-minute review
I… [+15677 chars]",https://www.techradar.com/audio/earbuds-airpods/denon-ah-c500w-review,TechRadar
2025-07-22T16:00:00Z,The Fantastic Four: First Steps Finally Gives Marvel's Oldest Team Some Respect,"'The Fantastic Four: First Steps' brings Pedro Pascal, Vanessa Kirby, Ebon Moss-Bachrach, and Joseph Quinn to the screen as Marvel's oldest team—and it's good.","ISN'T IT ABOUT time we got a good Fantastic Four movie? While Marvel's most famous quartet have been among the publisher's signature heroes since their debut in November 1961's The Fantastic Four #1,… [+6964 chars]",https://www.menshealth.com/entertainment/a65475639/fantastic-four-first-steps-mcu-review/,menshealth.com
2025-07-22T15:59:44Z,Report: EU set to accept Apple’s latest App Store rules under the DMA,"Last month, Apple announced another set of major changes to the App Store in the European Union, as part of its ongoing back-and-forth with regulators about the Digital Markets Act. 



According to a new report from Reuters, Apple’s latest changes just might…","Last month, Apple announced another set of major changes to the App Store in the European Union, as part of its ongoing back-and-forth with regulators about the Digital Markets Act. 
According to a … [+1675 chars]",https://9to5mac.com/2025/07/22/report-eu-set-to-accept-apples-latest-app-store-rules-under-the-dma/,9to5Mac
2025-07-22T15:59:29Z,"Apple set to stave off daily fines, EU to accept App Store changes",Apple made the changes after the EU antitrust enforcer handed it a €500 million fine in April,"Apples changes to its App Store rules and fees will likely secure the green light from EU antitrust regulators, people with direct knowledge of the matter said, a move that would stave off potentiall… [+1332 chars]",https://www.irishtimes.com/business/2025/07/22/apple-set-to-stave-off-daily-fines-eu-to-accept-app-store-changes/,The Irish Times
2025-07-22T15:57:56Z,How Trump is making America hungrier,"One of the most far-reaching cuts to federal programs in President Donald Trump’s “big, beautiful bill” is a provision that will largely shift the cost of the Supplemental Nutrition Assistance Program (SNAP) to the states. Until now, the federal government ha…","The Congressional Budget Office estimates more than 3 million people in the United States will likely be dropped from the accessing SNAP benefits. | Scott Heins/Getty Images


One of the most far-re… [+8416 chars]",https://www.vox.com/today-explained-podcast/420613/trump-snap-benefits-cut-hunger,Vox
2025-07-22T15:57:49Z,Disney Reveals Details Of The Live Action ‘Lilo & Stitch’ 4K Blu-Ray Release,"Steelbook packaging, Dolby Vision video and a solid selection of extra features ahoy.","With its live-action remake of Lilo &amp; Stitch recently pushing past a $1 billion take at the global box office, Disney has decided the time is right to announce details of its box office smashs 4K… [+3672 chars]",https://www.forbes.com/sites/johnarcher/2025/07/22/disney-reveals-details-of-the-live-action-lilo--stitch-4k-blu-ray-release/,Forbes
2025-07-22T15:57:00Z,Report: Hakeem Jeffries Thinks Democrats Will Miss Shot to Retake House Majority Because of Socialist Zohran Mamdani,"Mark Halperin claims House Democrat Leader Hakeem Jeffries ""strongly believes"" that if socialist Zohran Mamdani becomes the next mayor of NYC, Democrats cannot win back the House majority.
The post Report: Hakeem Jeffries Thinks Democrats Will Miss Shot to Re…","Mark Halperin claimed House Democrat Leader Hakeem Jeffries (D-NY) “strongly believes” that if socialist Zohran Mamdani becomes the next mayor of New York City, Democrats cannot win back the House ma… [+1770 chars]",https://www.breitbart.com/politics/2025/07/22/report-hakeem-jeffries-thinks-democrats-will-miss-shot-retake-house-majority-because-socialist-zohran-mamdani/,Breitbart News
2025-07-22T15:55:40Z,MeitY consults ministries amidst China’s ‘choking’ of India’s tech supply chain,"China commands over 90% share of global production and processing of rare earth elements and critical minerals – essential for EVs, automobiles, smartphones and other electronics.","Addressing the Indian industrys concerns about China restricting import of capital equipment and critical minerals, the Ministry of Electronics and Information Technology (MeitY) is organising inter-… [+2758 chars]",https://www.thehindubusinessline.com/economy/meity-consults-ministries-amidst-chinas-choking-of-indias-tech-supply-chain/article69842950.ece,BusinessLine
2025-07-22T15:54:02Z,Apple starts selling its products directly in Saudi Arabia,"Apple has officially landed in Saudi Arabia. Not that its products hadn't been available over there so far, but now the company has opened its official online store in the country. You can also use the Apple Store app in Saudi Arabia, and both support the Ara…","Apple has officially landed in Saudi Arabia. Not that its products hadn't been available over there so far, but now the company has opened its official online store in the country. You can also use t… [+1289 chars]",https://www.gsmarena.com/apple_starts_selling_its_products_directly_in_saudi_arabia-news-68724.php,GSMArena.com
2025-07-22T15:53:19Z,This Is Spinal Tap Now Available in 4K Ultra HD,"The digital version is out now, with the physical release following on September 16th.
This Is Spinal Tap Now Available in 4K Ultra HD
Eddie Fu","A new 4K Ultra HD restoration of Rob Reiner’s classic 1984 mockumentary, This Is Spinal Tap, is now available to purchase on digital platforms, with the physical release following on September 16th.… [+615 chars]",https://consequence.net/2025/07/this-is-spinal-tap-4k-ultra-hd/,Consequence.net
2025-07-22T15:52:33Z,"Exclusive-Apple set to stave off daily fines, EU to accept App Store changes, sources say","In This Article:
By Foo Yun Chee
BRUSSELS (Reuters) -Apple's changes to its App Store rules and fees will likely secure the green light from EU antitrust regulators, people with direct knowledge of the matter said, a move that would stave off potentially heft…","In This Article:By Foo Yun CheeBRUSSELS (Reuters) -Apple's changes to its App Store rules and fees will likely secure the green light from EU antitrust regulators, people with direct knowledge of the… [+149 chars]",https://biztoc.com/x/8de760d45dfe824e,Biztoc.com
2025-07-22T15:51:53Z,This 1440p OLED gaming monitor is now cheaper than it was on Prime Day,"When it comes to PCWorld’s Amazon Prime Day coverage, it’s my job to handle the monitor segment—and this year, it didn’t escape my notice that, despite a general downward trend in OLED prices, the cheapest one during Prime Day was about 20 percent more expens…","Skip to contentType your search and hit enter
When you purchase through links in our articles, we may earn a small commission. This doesn't affect our editorial independence
.
When it comes to PCW… [+1973 chars]",https://www.pcworld.com/article/2855492/this-1440p-oled-gaming-monitor-is-now-cheaper-than-it-was-on-prime-day.html,PCWorld
2025-07-22T15:51:53Z,Score this 1440p OLED gaming monitor for an absurdly cheap $428,"When it comes to PCWorld’s Amazon Prime Day coverage, it’s my job to handle the monitor segment—and this year, it didn’t escape my notice that, despite a general downward trend in OLED prices, the cheapest one during Prime Day was about 20 percent more expens…","Skip to contentType your search and hit enter
When you purchase through links in our articles, we may earn a small commission. This doesn't affect our editorial independence
.
When it comes to PCW… [+1973 chars]",https://www.pcworld.com/article/2855492/score-this-1440p-oled-gaming-monitor-for-an-absurdly-cheap-428.html,PCWorld
2025-07-22T15:51:53Z,Apple offers new game aimed at Wordle fans,"One of the few bright spots to come out of the pandemic was Wordle, the daily word puzzle created by software engineer Josh Wardle. 
He originally made the game in 2021 as a gift for his partner, Palak Shah. After sharing it with friends and family, it quickl…","One of the few bright spots to come out of the pandemic was Wordle, the daily word puzzle created by software engineer Josh Wardle. He originally made the game in 2021 as a gift for his partner, Pala… [+141 chars]",https://biztoc.com/x/05d9bafb1d0b602e,Biztoc.com
2025-07-22T15:51:04Z,Apple's AI team grew fast but it probably won't shrink as quickly,"Apple's foundational models team is key to the company's artificial intelligence efforts, but while the rapidly-formed group has endured managerial turmoil, it's not necessarily going to lose all of its main members.The type of question Apple promises Siri wi…","Apple's foundational models team is key to the company's artificial intelligence efforts, but while the rapidly-formed group has endured managerial turmoil, it's not necessarily going to lose all of … [+5355 chars]",https://appleinsider.com/articles/25/07/22/apples-ai-team-grew-fast-but-it-probably-wont-shrink-as-quickly,AppleInsider
2025-07-22T15:50:33Z,Apple avoids huge daily fines as EU accepts App Store policy changes,"Apple’s revised App Store rules and fees are expected to gain approval from EU antitrust regulators, according to sources…
The post Apple avoids huge daily fines as EU accepts App Store policy changes appeared first on MacDailyNews.","Apples revised App Store rules and fees are expected to gain approval from EU antitrust regulators, according to sources with direct knowledge, a move that would prevent substantial daily fines for t… [+1340 chars]",https://macdailynews.com/2025/07/22/apple-avoids-huge-daily-fines-as-eu-accepts-app-store-policy-changes/,Macdailynews.com
2025-07-22T15:49:22Z,‘Ted Lasso’ Makes Triumphant Return: Season 4 Production Begins with Fresh Faces and Familiar Hearts,"The beloved Apple TV+ comedy that captured hearts worldwide is officially back in production, as ‘Ted Lasso’ Season 4 commences filming with an exciting blend of returning favorites and promising newcomers.Jason Sudeikis leads the charge once again as the opt…","The beloved Apple TV+ comedy that captured hearts worldwide is officially back in production, as ‘Ted Lasso’ Season 4 commences filming with an exciting blend of returning favorites and promising new… [+3400 chars]",https://anglotopia.net/brit-tv/ted-lasso-makes-triumphant-return-season-4-production-begins-with-fresh-faces-and-familiar-hearts/,Anglotopia.net
2025-07-22T15:48:30Z,MLB Insider Suggests Mets Pair Edwin Diaz With Emmanuel Clase,"The New York Mets could be one of the more aggressive buyers at the trade deadline, and it might result in a huge trade with the Cleveland Guardians.","The New York Mets need to add pitching ahead of the trade deadline, plain and simple.
Their pitching staff hasn't been good enough to win a World Series, which is the ultimate goal, especially after… [+1961 chars]",https://www.newsweek.com/sports/mlb/mlb-insider-suggests-mets-pair-edwin-diaz-emmanuel-clase-2102451,Newsweek
2025-07-22T15:47:00Z,T-Mobile Is Bringing Starlink to Your Phone Tomorrow. See If You’ll Get It For Free,Are dead zones a thing of the past? T-Mobile and Starlink's new satellite cell service thinks so. Here’s what you need to know.,"Going off-grid might soon be a thing of the past, as T-Mobile’s partnership with SpaceX’s Starlink satellite internet service gets ready to launch on July 23. The direct-to-cell messaging service, ca… [+7411 chars]",https://www.cnet.com/tech/mobile/t-mobile-is-bringing-starlink-to-your-phone-tomorrow-see-if-youll-get-it-for-free/,CNET
2025-07-22T15:47:00Z,"It's Wise to Wash All Produce, but These 12 Fruits and Veggies Are the Dirtiest","Most produce arrives to your home safe for consumption, according to the USDA, but washing these 12 types of fruits and vegetables is still a good idea.","Cleaning your fridge and freezer is important to do every so often, but what about the food sitting inside it? Specifically, that bottom drawer, where fruits and veggies go to retire. Even the health… [+4801 chars]",https://www.cnet.com/home/kitchen-and-household/its-wise-to-wash-all-produce-but-these-12-fruits-and-veggies-are-the-dirtiest/,CNET
2025-07-22T15:45:38Z,"Deals: M3 iPad Air all-time low at $250 off, 24GB MacBook Air $180 off, Mac mini, and more",Today’s 9to5Toys Lunch Break deals are starting with a new Amazon all-time low on the 1TB M3 iPad Air – the 11-inch Cell model is now just shy of $250 off to deliver the lowest price we have tracked to date. From there we move over to a couple Mac models that…,Todays 9to5Toys Lunch Break deals are starting with a new Amazon all-time low on the 1TB M3 iPad Air the 11-inch Cell model is now just shy of $250 off to deliver the lowest price we have tracked to … [+6620 chars],https://9to5mac.com/2025/07/22/deals-m3-ipad-air-24gb-macbook-air-mac-mini/,9to5Mac
2025-07-22T15:45:00Z,What does the US GENIUS Act mean for stablecoins?,"The Genius Act is a US law aimed at establishing federal oversight for stablecoin issuers, setting rules for reserves, redemption rights, and licensing requirements.","What is the GENIUS Act? 
The GENIUS Act is a United States federal law that creates a comprehensive regulatory framework for stablecoins.
The Guiding and Empowering Nation’s Innovation for US Stabl… [+8548 chars]",https://cointelegraph.com/explained/what-does-the-us-genius-act-mean-for-stablecoins,Cointelegraph
2025-07-22T15:45:00Z,Refurb MacBook Pro proves aging gracefully is possible,72% off refurbished 2019 Apple MacBook Pro,"Discover startups, services, products and more from our partner StackCommerce. New York Post edits this content, and may be compensated and/or receive an affiliate commission if you buy through our l… [+1814 chars]",https://nypost.com/2025/07/22/shopping/refurbished-apple-macbook-pro-13-3-inch-2019-with-touchbar-is-71-off/,New York Post
2025-07-22T15:43:29Z,Grow A Garden Zen Points Guide,"Our guide on Grow A Garden Zen Points, with the point values for different kinds of fruit and examples of the categories.","The Zen event promises new items, new plants, and some extremely interesting new pets. If you want to get hold of them, then you should get to know the world of Grow A Garden Zen Points.
Grow A Gard… [+1572 chars]",https://www.droidgamers.com/guides/grow-a-garden-zen-points-guide/,DroidGamers
2025-07-22T15:43:10Z,Apple Testing iPhone 17 Pro Color That Changes Before Your Eyes,"Apple could be cooking up something special for the iPhone 17 Pro's color lineup, if a singular rumor out of Asia is anything to go by.   Chinese...","Apple could be cooking up something special for the iPhone 17 Pro's color lineup, if a singular rumor out of Asia is anything to go by.
Chinese leaker Instant Digital has hinted at a mysterious new … [+1184 chars]",https://www.macrumors.com/2025/07/22/liquid-glass-color-iphone-17-pro/,MacRumors
2025-07-22T15:42:38Z,iOS 26 Public Beta with new security tools is about to ship,"The first public beta of iOS 26 is about to ship (probably on Wednesday, July 23). When it does, it will introduce two powerful new call-related features that should make a difference to business and personal communications: smart call and iMessage screening.…","It is highly probable that your personal or work iPhone receives weird spam messages. While all of these are annoying, some can also be quite convincing attempts to trick you into sharing information… [+768 chars]",https://www.computerworld.com/article/4026476/ios-26-public-beta-with-new-security-tools-is-about-to-ship.html,Computerworld
2025-07-22T15:42:23Z,"Apple has won a Patent for an Edge Illuminator for a Future HomePod, Watch Band, Macs, iPhone, iPad, Clothing & more","Apple was granted a patent today that describes an edge illuminator—a thin, one-dimensional display made of light-emitting diodes (LEDs) or similar components that wraps around or lines the edges of a device. It’s designed to provide low-resolution visual fee…","Apple was granted a patent today that describes an edge illuminatora thin, one-dimensional display made of light-emitting diodes (LEDs) or similar components that wraps around or lines the edges of a… [+4340 chars]",https://www.patentlyapple.com/2025/07/apple-has-won-a-patent-for-an-edge-illuminator-for-a-future-homepod-watch-band-macs-iphone-ipad-clothing-more.html,Patently Apple
