date,headline,summary,text,url,source
2025-07-22T15:42:18Z,"Exclusive-Apple set to stave off daily fines, EU to accept App Store changes, sources say","BRUSSELS :Apple's changes to its App Store rules and fees will likely secure the green light from EU antitrust regulators, people with direct knowledge of the matter said, a move that would stave off potentially hefty daily fines for the iPhone maker.The comp…","BRUSSELS :Apple's changes to its App Store rules and fees will likely secure the green light from EU antitrust regulators, people with direct knowledge of the matter said, a move that would stave off… [+1344 chars]",https://www.channelnewsasia.com/business/exclusive-apple-set-stave-daily-fines-eu-accept-app-store-changes-sources-say-5252251,CNA
2025-07-22T15:41:24Z,Car Deal of the Day: an award-winning Volvo EX30 for just £286 a month,"The Volvo EX30 is an excellent all-round EV, and it’s our Deal of the Day for July 22","<ul><li>Easy to drive; cool Swedish design</li><li>209-mile range</li><li>Just £285.79 a month </li></ul>Volvo's smallest electric SUV, the EX30, might possess much of the larger EX90's premium touch… [+2109 chars]",https://www.autoexpress.co.uk/volvo/ex30/367411/car-deal-day-award-winning-volvo-ex30-just-ps286-month,AutoExpress
2025-07-22T15:40:00Z,Ubisoft reports first-quarter 2025-26 sales,UBISOFT REPORTS FIRST-QUARTER 2025-26 SALES     In €mQ12025-26    Reported change vs.Q1 2024-25    % of total net bookings      Q1 2025-26  Q1 2024-25...,"UBISOFT REPORTS FIRST-QUARTER 2025-26 SALES
<table><tr><td>   </td><td>In mQ12025-26</td><td>Reported change vs.Q1 2024-25</td><td>% of total net bookings </td></tr><tr><td>   </td><td>Q1 2025-26</t… [+15963 chars]",https://www.globenewswire.com/news-release/2025/07/22/3119685/0/en/Ubisoft-reports-first-quarter-2025-26-sales.html,GlobeNewswire
2025-07-22T15:40:00Z,Ubisoft annonce son chiffre d’affaires du premier trimestre 2025-26,UBISOFT ANNONCE SON CHIFFRE D’AFFAIRES DU PREMIER TRIMESTRE 2025-26     En M€T12025-26    Variation publiée vs.T1 2024-25    En % du net bookings total  ...,"UBISOFT ANNONCE SON CHIFFRE DAFFAIRES DU PREMIER TRIMESTRE 2025-26
<table><tr><td>   </td><td>En MT12025-26</td><td>Variation publiée vs.T1 2024-25</td><td>En % du net bookings total </td></tr><tr><… [+17609 chars]",https://www.globenewswire.com/news-release/2025/07/22/3119685/0/fr/Ubisoft-annonce-son-chiffre-d-affaires-du-premier-trimestre-2025-26.html,GlobeNewswire
2025-07-22T15:39:43Z,Namibia Unveils Bold Reform to Regain Upper-Middle-Income Status,"Namibia unveiled an ambitious development plan targeting average economic growth of 7% over the next five years, as it seeks to restore its upper-middle-income status by the end of the decade.","(Bloomberg) Namibia unveiled an ambitious development plan targeting average economic growth of 7% over the next five years, as it seeks to restore its upper-middle-income status by the end of the de… [+3988 chars]",https://financialpost.com/pmn/business-pmn/namibia-unveils-bold-reform-to-regain-upper-middle-income-status,Financial Post
2025-07-22T15:39:24Z,"Exclusive-Apple set to stave off daily fines, EU to accept App Store changes, sources say","BRUSSELS (Reuters) -Apple's changes to its App Store rules and fees will likely secure the green light from EU antitrust regulators, people with direct...","By Foo Yun Chee
BRUSSELS (Reuters) -Apple's changes to its App Store rules and fees will likely secure the green light from EU antitrust regulators, people with direct knowledge of the matter said, … [+1574 chars]",https://finance.yahoo.com/news/exclusive-apple-set-stave-off-153924729.html,Yahoo Entertainment
2025-07-22T15:39:00Z,iPhone 17 series backed to sell over 10% better than 16 series,"The iPhone 17 series might comprise some of the most innovative Apple handsets for several generations in 2025 - not the least the brand's first ever ultra-slim model. Now, they are backed to sustain at least as much growth on the market as their predecessors…",Apple is thought to do something approaching an actual risk with the design of the iPhone 17 Pro and Pro Max - even if it mostly involves taking the chance of being relentlessly compared to the Googl… [+978 chars],https://www.notebookcheck.net/iPhone-17-series-backed-to-sell-over-10-better-than-16-series.1064966.0.html,Notebookcheck.net
2025-07-22T15:36:24Z,Telegram Users in US Can Now Access Native Crypto Wallet,American users of popular messaging app Telegram can now access the native crypto wallet app that launched elsewhere in 2023.,"In brief
<ul><li>Telegram's native crypto wallet app is rolling out to users in the United States. </li><li>The TON Wallet allows users to buy, sell, and send crypto directly in the Telegram messagi… [+3191 chars]",https://decrypt.co/331236/telegram-users-us-access-native-ton-crypto-wallet,Decrypt
2025-07-22T15:36:13Z,Apple Could Offer Six Different New iPhone Models in 2027,"Apple could offer at least six different iPhone models in 2027, according to a proven leaker on Weibo.





According to a post from the leaker known as ""Instant Digital,"" there may be at least six new ‌iPhone‌ models to choose from in 2027. From the unveilin…","Apple could offer at least six different iPhone models in 2027, according to a proven leaker on Weibo.
According to a post from the leaker known as ""Instant Digital,"" there may be at least six new ‌… [+1151 chars]",https://www.macrumors.com/2025/07/22/six-different-new-iphones-in-2027/,MacRumors
2025-07-22T15:33:23Z,Download your photos before AT&T shuts down its cloud storage service permanently,"Come October, AT&T's Photo Storage service will stop backing up your files. Here's how to grab them before they're gone.","AT&amp;T / Elyse Betters Picaro / ZDNET
AT&amp;T has long offered certain subscribers a free online storage app and service designed to back up photos from their phones. That certainly sounds handy.… [+3140 chars]",https://www.zdnet.com/article/download-your-photos-before-at-t-shuts-down-its-cloud-storage-service-permanently/,ZDNet
2025-07-22T15:33:00Z,Morgan Stanley reboots Google stock price target ahead of earnings,Expectations are adjusted as the tech giant preps for a key moment,"Morgan Stanley reboots Google stock price target ahead of earnings originally appeared on TheStreet.
Being scrutinized yet being on the cusp isnt new for Google  (GOOGL) stock.
However, its next ac… [+4577 chars]",https://www.thestreet.com/technology/morgan-stanley-reboots-google-stock-price-target-ahead-of-earnings,TheStreet
2025-07-22T15:31:56Z,18 Reasons to Wait for the iPhone 17,Apple's iPhone development roadmap runs several years into the future and the company is continually working with suppliers on several successive...,"Apple's iPhone development roadmap runs several years into the future and the company is continually working with suppliers on several successive iPhone models simultaneously, which is why we often g… [+13523 chars]",https://www.macrumors.com/2025/07/22/17-reasons-to-wait-for-the-iphone-17/,MacRumors
2025-07-22T15:30:24Z,Michelin mess: How Apple Maps fumbles location details,"Apple Maps navigation might be on par with Google’s these days, but Apple’s location data is not. Google offers broad coverage for many points of interest, while Apple’s data has mostly relied on knitting together bits from competing business partners.…","Apple Maps navigation might be on par with Googles these days, but Apples location data is not. Google offers broad coverage for many points of interest, while Apples data has mostly relied on knitti… [+8925 chars]",https://sixcolors.com/post/2025/07/michelin-mess-how-apple-maps-fumbles-the-location-details/,sixcolors.com
2025-07-22T15:29:06Z,BMW Confirms It Won’t Support Apple CarPlay Ultra,"Apple’s new CarPlay Ultra system is finally here, bringing a more immersive version of its in-car interface to production vehicles. But if you’re a BMW driver hoping to get it anytime soon, don’t hold your...
First published by https://www.bmwblog.com","Apples new CarPlay Ultra system is finally here, bringing a more immersive version of its in-car interface to production vehicles. But if youre a BMW driver hoping to get it anytime soon, dont hold y… [+2108 chars]",https://www.bmwblog.com/2025/07/22/bmw-no-carplay-ultra-idrive-x/,BMWBLOG
2025-07-22T15:28:47Z,Justin Bieber’s ‘Swag’ vs. Travis Scott’s ‘Jackboys 2’: Inside the Closest Chart Battle We’ve Seen in Years,"There’s little question that Justin Bieber’s surprise-release of “Swag,” his first album in four years, on July 10 was one of the biggest bombshells of the year in the music world, and its huge first-week numbers reflect that. It was the biggest streaming deb…","There’s little question that Justin Bieber’s surprise-release of “Swag,” his first album in four years, on July 10 was one of the biggest bombshells of the year in the music world, and its huge first… [+7003 chars]",https://variety.com/2025/music/news/justin-bieber-swag-travis-scott-jackboys-2-chart-battle-1236466875/,Variety
